{
  "format_version": 1,
  "currency_prefixes": [
    "",
    "Currency"
  ],
  "currency_codes": [
    "AED",
    "AFN",
    "ALL",
    "AMD",
    "ANG",
    "AOA",
    "ARS",
    "AUD",
    "AWG",
    "AZN",
    "BAM",
    "BBD",
    "BDT",
    "BGN",
    "BHD",
    "BIF",
    "BMD",
    "BND",
    "BOB",
    "BOV",
    "BRL",
    "BSD",
    "BTN",
    "BWP",
    "BYN",
    "BZD",
    "CAD",
    "CDF",
    "CHE",
    "CHF",
    "CHW",
    "CLF",
    "CLP",
    "CNY",
    "COP",
    "COU",
    "CRC",
    "CUP",
    "CVE",
    "CZK",
    "DJF",
    "DKK",
    "DOP",
    "DZD",
    "EGP",
    "ERN",
    "ETB",
    "EUR",
    "FJD",
    "FKP",
    "GBP",
    "GEL",
    "GHS",
    "GIP",
    "GMD",
    "GNF",
    "GTQ",
    "GYD",
    "HKD",
    "HNL",
    "HTG",
    "HUF",
    "IDR",
    "ILS",
    "INR",
    "IQD",
    "IRR",
    "ISK",
    "JMD",
    "JOD",
    "JPY",
    "KES",
    "KGS",
    "KHR",
    "KMF",
    "KPW",
    "KRW",
    "KWD",
    "KYD",
    "KZT",
    "LAK",
    "LBP",
    "LKR",
    "LRD",
    "LSL",
    "LYD",
    "MAD",
    "MDL",
    "MGA",
    "MKD",
    "MMK",
    "MNT",
    "MOP",
    "MRU",
    "MUR",
    "MVR",
    "MWK",
    "MXN",
    "MXV",
    "MYR",
    "MZN",
    "NAD",
    "NGN",
    "NIO",
    "NOK",
    "NPR",
    "NZD",
    "OMR",
    "PAB",
    "PEN",
    "PGK",
    "PHP",
    "PKR",
    "PLN",
    "PYG",
    "QAR",
    "RON",
    "RSD",
    "RUB",
    "RWF",
    "SAR",
    "SBD",
    "SCR",
    "SDG",
    "SEK",
    "SGD",
    "SHP",
    "SLE",
    "SOS",
    "SRD",
    "SSP",
    "STN",
    "SVC",
    "SYP",
    "SZL",
    "THB",
    "TJS",
    "TMT",
    "TND",
    "TOP",
    "TRY",
    "TTD",
    "TWD",
    "TZS",
    "UAH",
    "UGX",
    "USD",
    "USN",
    "UYI",
    "UYU",
    "UYW",
    "UZS",
    "VED",
    "VES",
    "VND",
    "VUV",
    "WST",
    "XAD",
    "XAF",
    "XAG",
    "XAU",
    "XBA",
    "XBB",
    "XBC",
    "XBD",
    "XCD",
    "XCG",
    "XDR",
    "XOF",
    "XPD",
    "XPF",
    "XPT",
    "XSU",
    "XUA",
    "YER",
    "ZAR",
    "ZMW",
    "ZWG",
    "ZWL"
  ],
  "units": [
    {
      "ref": "CanadianDollar",
      "kind": "money",
      "currency": "CAD",
      "prices": null,
      "evidence": "Base Data Commons twin of CurrencyCAD; the ref does not state prices."
    },
    {
      "ref": "ChainedUSDollarBaseYr2012",
      "kind": "money",
      "currency": "USD",
      "prices": "constant",
      "base_year": 2012,
      "chained": true,
      "evidence": "Chained US dollars with base year 2012: chain-linking and the base year are both stated in the ref."
    },
    {
      "ref": "ChainedUSDollarBaseYr2017",
      "kind": "money",
      "currency": "USD",
      "prices": "constant",
      "base_year": 2017,
      "chained": true,
      "evidence": "Chained US dollars with base year 2017: chain-linking and the base year are both stated in the ref."
    },
    {
      "ref": "ConstantPriceUSDollar2015",
      "kind": "money",
      "currency": "USD",
      "prices": "constant",
      "base_year": 2015,
      "chained": false,
      "evidence": "Constant 2015 US dollars, stated in the ref."
    },
    {
      "ref": "Euro",
      "kind": "money",
      "currency": "EUR",
      "prices": null,
      "evidence": "Base Data Commons twin of CurrencyEUR; the ref does not state prices."
    },
    {
      "ref": "IndianRupee",
      "kind": "money",
      "currency": "INR",
      "prices": null,
      "evidence": "Base Data Commons twin of CurrencyINR; the ref does not state prices."
    },
    {
      "ref": "Per100000Females",
      "kind": "rate",
      "count_base": 100000,
      "counted": "females",
      "evidence": "Graph label 'Per 100k females', on series such as Count_Death_IntentionalSelfHarm_Female_AsFractionOf_Count_Person_Female."
    },
    {
      "ref": "Per100000Males",
      "kind": "rate",
      "count_base": 100000,
      "counted": "males",
      "evidence": "Graph label 'Per 100k males', on series such as Count_CriminalActivities_MurderAndNonNegligentManslaughter_Male_AsFractionOf_Count_Person_Male."
    },
    {
      "ref": "Per100000Persons",
      "kind": "rate",
      "count_base": 100000,
      "counted": "people",
      "evidence": "Graph label 'Per 100k people', on series such as Count_Death_IntentionalSelfHarm_AsFractionOf_Count_Person."
    },
    {
      "ref": "Per1000FemaleLiveBirths",
      "kind": "rate",
      "count_base": 1000,
      "counted": "female live births",
      "evidence": "Graph label 'Per 1000 female live births', on series such as Count_Death_0Years_Female_AsFractionOf_Count_BirthEvent_LiveBirth_Female."
    },
    {
      "ref": "Per1000LiveBirths",
      "kind": "rate",
      "count_base": 1000,
      "counted": "live births",
      "evidence": "Graph label 'Per 1000 live births', on series such as Count_Death_0Years_AsFractionOf_Count_BirthEvent_LiveBirth."
    },
    {
      "ref": "Per1000MaleLiveBirths",
      "kind": "rate",
      "count_base": 1000,
      "counted": "male live births",
      "evidence": "Graph label 'Per 1000 male live births', on series such as Count_Death_0Years_Male_AsFractionOf_Count_BirthEvent_LiveBirth_Male."
    },
    {
      "ref": "Per1000Persons",
      "kind": "rate",
      "count_base": 1000,
      "counted": "people",
      "evidence": "Graph label 'Per 1000 people', on series such as Count_BirthEvent_LiveBirth_AsFractionOf_Count_Person."
    },
    {
      "ref": "Per100Persons",
      "kind": "rate",
      "count_base": 100,
      "counted": "people",
      "evidence": "Graph label 'Per 100 Persons', on series such as Count_Person_COVID19."
    },
    {
      "ref": "Percent",
      "kind": "percent",
      "evidence": "Per cent of the denominator the variable names."
    },
    {
      "ref": "SDG_CON_USD",
      "kind": "money",
      "currency": "USD",
      "prices": "constant",
      "base_year": null,
      "chained": false,
      "evidence": "SDG unit: constant US dollars; the ref states no base year."
    },
    {
      "ref": "SDG_CU_USD",
      "kind": "money",
      "currency": "USD",
      "prices": "current",
      "base_year": null,
      "chained": false,
      "evidence": "SDG unit: current US dollars."
    },
    {
      "ref": "SDG_NUMBER",
      "kind": "count",
      "evidence": "SDG unit: a number of things."
    },
    {
      "ref": "SDG_PERCENT",
      "kind": "percent",
      "evidence": "SDG unit: per cent."
    },
    {
      "ref": "SDG_PER_1000000_POP",
      "kind": "rate",
      "count_base": 1000000,
      "counted": "people",
      "evidence": "Graph label 'Per million population', on series such as sdg/GB_POP_SCIERD."
    },
    {
      "ref": "SDG_PER_100000_EMP",
      "kind": "rate",
      "count_base": 100000,
      "counted": "employees",
      "evidence": "Graph label 'Per 100,000 employees', on series such as sdg/SL_EMP_FTLINJUR."
    },
    {
      "ref": "SDG_PER_100000_LIVE_BIRTHS",
      "kind": "rate",
      "count_base": 100000,
      "counted": "live births",
      "evidence": "Graph label 'Per 100,000 live births', on series such as sdg/SH_STA_MORT.SEX--F."
    },
    {
      "ref": "SDG_PER_100000_POP",
      "kind": "rate",
      "count_base": 100000,
      "counted": "people",
      "evidence": "Graph label 'Per 100,000 population', on series such as sdg/SM_POP_REFG_OR."
    },
    {
      "ref": "SDG_PER_10000_POP",
      "kind": "rate",
      "count_base": 10000,
      "counted": "people",
      "evidence": "Graph label 'Per 10,000 population', on series such as sdg/SH_MED_DEN.OCCUPATION--ISCO08_2261."
    },
    {
      "ref": "SDG_PER_1000_LIVE_BIRTHS",
      "kind": "rate",
      "count_base": 1000,
      "counted": "live births",
      "evidence": "Graph label 'Per 1,000 live births', on series such as sdg/SH_DYN_IMRT.AGE--Y0__SEX--F."
    },
    {
      "ref": "SDG_PER_1000_POP",
      "kind": "rate",
      "count_base": 1000,
      "counted": "people",
      "evidence": "Graph label 'Per 1,000 population', on series such as sdg/SP_DYN_ADKL.AGE--Y10T14__SEX--F."
    },
    {
      "ref": "SDG_PER_1000_UNINFECTED_POP",
      "kind": "rate",
      "count_base": 1000,
      "counted": "uninfected people",
      "evidence": "Graph label 'Per 1,000 uninfected population', on series such as sdg/SH_HIV_INCD.SEX--F."
    },
    {
      "ref": "USDollar",
      "kind": "money",
      "currency": "USD",
      "prices": null,
      "evidence": "Base Data Commons twin of CurrencyUSD; the ref does not state prices."
    },
    {
      "ref": "undata/UNIT_MEASURE-COUNT",
      "kind": "count",
      "evidence": "UN count unit; what is counted is on the variable."
    },
    {
      "ref": "undata/UNIT_MEASURE-COUNT_BIRTHS",
      "kind": "count",
      "evidence": "UN count unit; what is counted is on the variable."
    },
    {
      "ref": "undata/UNIT_MEASURE-COUNT_CASES",
      "kind": "count",
      "evidence": "UN count unit; what is counted is on the variable."
    },
    {
      "ref": "undata/UNIT_MEASURE-COUNT_DALY",
      "kind": "count",
      "evidence": "UN count unit; what is counted is on the variable."
    },
    {
      "ref": "undata/UNIT_MEASURE-COUNT_DEATHS",
      "kind": "count",
      "evidence": "UN count unit; what is counted is on the variable."
    },
    {
      "ref": "undata/UNIT_MEASURE-COUNT_INFECTIONS",
      "kind": "count",
      "evidence": "UN count unit; what is counted is on the variable."
    },
    {
      "ref": "undata/UNIT_MEASURE-COUNT_PERSONS",
      "kind": "count",
      "evidence": "UN count unit; what is counted is on the variable."
    },
    {
      "ref": "undata/UNIT_MEASURE-COUNT_PERSONS_CHILD",
      "kind": "count",
      "evidence": "UN count unit; what is counted is on the variable."
    },
    {
      "ref": "undata/UNIT_MEASURE-COUNT_PERSONS_F",
      "kind": "count",
      "evidence": "UN count unit; what is counted is on the variable."
    },
    {
      "ref": "undata/UNIT_MEASURE-COUNT_PERSONS_PRISONER",
      "kind": "count",